{
  "id": "claim_example",
  "claim": "Research tools should preserve evidence trails.",
  "claim_type": "normative",
  "domains": ["research"],
  "status": "supported",
  "confidence": 0.7,
  "supporting_source_ids": ["src_example"],
  "opposing_source_ids": [],
  "evidence_type": "self-authored example",
  "uncertainty_notes": "Example claim for schema demonstration only.",
  "created_at": "2026-06-14T00:00:00Z",
  "updated_at": "2026-06-14T00:00:00Z",
  "last_reviewed_at": null
}
